<!ELEMENT SUPER-ELEMENTO ((ELEMENTO+))>
<!ELEMENT SUB-ELEMENTO (#PCDATA)>
<!ELEMENT MEGA-ELEMENTO ((SUPER-ELEMENTO+))>
<!ELEMENT ELEMENTO (#PCDATA | SUB-ELEMENTO)*>
