<!DOCTYPE MEGA-ELEMENTO SYSTEM "1OMAS01.dtd">
<MEGA-ELEMENTO>
	<SUPER-ELEMENTO>
		<ELEMENTO>
			<SUB-ELEMENTO>
			
			</SUB-ELEMENTO>
		</ELEMENTO>
		<ELEMENTO>
		
		</ELEMENTO>
	</SUPER-ELEMENTO>
	<SUPER-ELEMENTO>
		<ELEMENTO>
			<SUB-ELEMENTO>
			
			</SUB-ELEMENTO>
		</ELEMENTO>
	</SUPER-ELEMENTO>
</MEGA-ELEMENTO>
